dataset_version,dataset_generated_datetime,dataset_linked_data_default,last_updated_datetime,xml_lang,default_currency,humanitarian,hierarchy,linked_data_uri,budget_not_provided,iati_identifier,reporting_org_ref,reporting_org_type,reporting_org_secondary_reporter,reporting_org_narrative,reporting_org_narrative_xml_lang,title_narrative,title_narrative_xml_lang,description_type,description_narrative,description_narrative_xml_lang,participating_org_ref,participating_org_type,participating_org_role,participating_org_activity_id,participating_org_crs_channel_code,participating_org_narrative,participating_org_narrative_xml_lang,other_identifier_ref,other_identifier_type,other_identifier_owner_org_ref,other_identifier_owner_org_narrative,other_identifier_owner_org_narrative_xml_lang,activity_status_code,activity_date_type,activity_date_iso_date,activity_date_narrative,activity_date_narrative_xml_lang,contact_info_type,contact_info_organisation_narrative,contact_info_organisation_narrative_xml_lang,contact_info_department_narrative,contact_info_department_narrative_xml_lang,contact_info_person_name_narrative,contact_info_person_name_narrative_xml_lang,contact_info_job_title_narrative,contact_info_job_title_narrative_xml_lang,contact_info_telephone,contact_info_email,contact_info_website,contact_info_mailing_address_narrative,contact_info_mailing_address_narrative_xml_lang,activity_scope_code,recipient_country_code,recipient_country_percentage,recipient_country_narrative,recipient_country_narrative_xml_lang,recipient_region_code,recipient_region_vocabulary,recipient_region_vocabulary_uri,recipient_region_percentage,recipient_region_narrative,recipient_region_narrative_xml_lang,location_ref,location_location_reach_code,location_location_id_code,location_location_id_vocabulary,location_name_narrative,location_name_narrative_xml_lang,location_description_narrative,location_description_narrative_xml_lang,location_activity_description_narrative,location_activity_description_narrative_xml_lang,location_administrative_code,location_administrative_vocabulary,location_administrative_level,location_point_srsName,location_point_pos,location_exactness_code,location_location_class_code,location_feature_designation_code,sector_vocabulary,sector_vocabulary_uri,sector_code,sector_percentage,sector_narrative,sector_narrative_xml_lang,tag_code,tag_vocabulary,tag_vocabulary_uri,tag_narrative,tag_narrative_xml_lang,country_budget_items_vocabulary,country_budget_items_budget_item_code,country_budget_items_budget_item_percentage,country_budget_items_budget_item_description_narrative,country_budget_items_budget_item_description_narrative_xml_lang,humanitarian_scope_type,humanitarian_scope_vocabulary,humanitarian_scope_vocabulary_uri,humanitarian_scope_code,humanitarian_scope_narrative,humanitarian_scope_narrative_xml_lang,policy_marker_vocabulary,policy_marker_vocabulary_uri,policy_marker_code,policy_marker_significance,policy_marker_narrative,policy_marker_narrative_xml_lang,collaboration_type_code,default_flow_type_code,default_finance_type_code,default_aid_type_code,default_aid_type_vocabulary,default_tied_status_code,planned_disbursement_type,planned_disbursement_period_start_iso_date,planned_disbursement_period_end_iso_date,planned_disbursement_value,planned_disbursement_value_currency,planned_disbursement_value_value_date,planned_disbursement_provider_org_ref,planned_disbursement_provider_org_provider_activity_id,planned_disbursement_provider_org_type,planned_disbursement_provider_org_narrative,planned_disbursement_provider_org_narrative_xml_lang,planned_disbursement_receiver_org_ref,planned_disbursement_receiver_org_receiver_activity_id,planned_disbursement_receiver_org_type,planned_disbursement_receiver_org_narrative,planned_disbursement_receiver_org_narrative_xml_lang,capital_spend_percentage,transaction_ref,transaction_humanitarian,transaction_transaction_type_code,transaction_transaction_date_iso_date,transaction_value,transaction_value_currency,transaction_value_value_date,transaction_description_narrative,transaction_description_narrative_xml_lang,transaction_provider_org_ref,transaction_provider_org_provider_activity_id,transaction_provider_org_type,transaction_provider_org_narrative,transaction_provider_org_narrative_xml_lang,transaction_receiver_org_ref,transaction_receiver_org_receiver_activity_id,transaction_receiver_org_type,transaction_receiver_org_narrative,transaction_receiver_org_narrative_xml_lang,transaction_disbursement_channel_code,transaction_sector_vocabulary,transaction_sector_vocabulary_uri,transaction_sector_code,transaction_sector_narrative,transaction_sector_narrative_xml_lang,transaction_recipient_country_code,transaction_recipient_country_narrative,transaction_recipient_country_narrative_xml_lang,transaction_recipient_region_code,transaction_recipient_region_vocabulary,transaction_recipient_region_vocabulary_uri,transaction_recipient_region_narrative,transaction_recipient_region_narrative_xml_lang,transaction_flow_type_code,transaction_finance_type_code,transaction_aid_type_code,transaction_aid_type_vocabulary,transaction_tied_status_code,document_link_url,document_link_format,document_link_title_narrative,document_link_title_narrative_xml_lang,document_link_description_narrative,document_link_description_narrative_xml_lang,document_link_category_code,document_link_language_code,document_link_document_date_iso_date,related_activity_ref,related_activity_type,legacy_data_name,legacy_data_value,legacy_data_iati_equivalent,conditions_attached,conditions_condition_type,conditions_condition_narrative,conditions_condition_narrative_xml_lang,result_type,result_aggregation_status,result_title_narrative,result_title_narrative_xml_lang,result_description_narrative,result_description_narrative_xml_lang,result_document_link_url,result_document_link_format,result_document_link_title_narrative,result_document_link_title_narrative_xml_lang,result_document_link_description_narrative,result_document_link_description_narrative_xml_lang,result_document_link_category_code,result_document_link_language_code,result_document_link_document_date_iso_date,result_reference_code,result_reference_vocabulary,result_reference_vocabulary_uri,result_indicator_measure,result_indicator_ascending,result_indicator_aggregation_status,result_indicator_title_narrative,result_indicator_title_narrative_xml_lang,result_indicator_description_narrative,result_indicator_description_narrative_xml_lang,result_indicator_document_link_url,result_indicator_document_link_format,result_indicator_document_link_title_narrative,result_indicator_document_link_title_narrative_xml_lang,result_indicator_document_link_description_narrative,result_indicator_document_link_description_narrative_xml_lang,result_indicator_document_link_category_code,result_indicator_document_link_language_code,result_indicator_document_link_document_date_iso_date,result_indicator_reference_vocabulary,result_indicator_reference_code,result_indicator_reference_indicator_uri,result_indicator_baseline_iso_date,result_indicator_baseline_year,result_indicator_baseline_value,result_indicator_baseline_location_ref,result_indicator_baseline_dimension_name,result_indicator_baseline_dimension_value,result_indicator_baseline_document_link_url,result_indicator_baseline_document_link_format,result_indicator_baseline_document_link_title_narrative,result_indicator_baseline_document_link_title_narrative_xml_lang,result_indicator_baseline_document_link_description_narrative,result_indicator_baseline_document_link_description_narrative_xml_lang,result_indicator_baseline_document_link_category_code,result_indicator_baseline_document_link_language_code,result_indicator_baseline_document_link_document_date_iso_date,result_indicator_baseline_comment_narrative,result_indicator_baseline_comment_narrative_xml_lang,result_indicator_period_period_start_iso_date,result_indicator_period_period_end_iso_date,result_indicator_period_target_value,result_indicator_period_target_location_ref,result_indicator_period_target_dimension_name,result_indicator_period_target_dimension_value,result_indicator_period_target_comment_narrative,result_indicator_period_target_comment_narrative_xml_lang,result_indicator_period_target_document_link_url,result_indicator_period_target_document_link_format,result_indicator_period_target_document_link_title_narrative,result_indicator_period_target_document_link_title_narrative_xml_lang,result_indicator_period_target_document_link_description_narrative,result_indicator_period_target_document_link_description_narrative_xml_lang,result_indicator_period_target_document_link_category_code,result_indicator_period_target_document_link_language_code,result_indicator_period_target_document_link_document_date_iso_date,result_indicator_period_actual_value,result_indicator_period_actual_location_ref,result_indicator_period_actual_dimension_name,result_indicator_period_actual_dimension_value,result_indicator_period_actual_comment_narrative,result_indicator_period_actual_comment_narrative_xml_lang,result_indicator_period_actual_document_link_url,result_indicator_period_actual_document_link_format,result_indicator_period_actual_document_link_title_narrative,result_indicator_period_actual_document_link_title_narrative_xml_lang,result_indicator_period_actual_document_link_description_narrative,result_indicator_period_actual_document_link_description_narrative_xml_lang,result_indicator_period_actual_document_link_category_code,result_indicator_period_actual_document_link_language_code,result_indicator_period_actual_document_link_document_date_iso_date,crs_add_other_flags_code,crs_add_other_flags_significance,crs_add_loan_terms_rate_1,crs_add_loan_terms_rate_2,crs_add_loan_terms_repayment_type_code,crs_add_loan_terms_repayment_plan_code,crs_add_loan_terms_commitment_date_iso_date,crs_add_loan_terms_repayment_first_date_iso_date,crs_add_loan_terms_repayment_final_date_iso_date,crs_add_loan_status_year,crs_add_loan_status_currency,crs_add_loan_status_value_date,crs_add_loan_status_interest_received,crs_add_loan_status_principal_outstanding,crs_add_loan_status_principal_arrears,crs_add_loan_status_interest_arrears,crs_add_channel_code,fss_extraction_date,fss_priority,fss_phaseout_year,fss_forecast,fss_forecast_year,fss_forecast_currency,fss_forecast_value_date
2.03,2022-07-11T05:00:00Z,,2022-07-11T06:03:02Z,,CAD,false,1,,,CA-3-A033236001,CA-3,10,,"Foreign Affairs\, Trade and Development Canada (DFATD),Affaires étrangères\, Commerce et Développement Canada (MAECD)","en,fr","Poverty Reduction Local Fund - Phase II,Fonds d'appui à la lutte contre la pauvreté - phase II","en,fr",1,"The Poverty Reduction Local Fund - Phase II (FALP II) responds to proposals from non-governmental organizations (NGOs) and development associations active in Niger. The funded initiatives helped to build the institutional capacities of partner organizations and to give the poorest\, mainly women and children\, better access to social services and basic nutrition. FALP II focuses its support on the Maradi\, Tillaberi\, and Tahoua regions.,Le Fonds d'appui à la lutte contre la pauvreté\, phase II (FALP II) répond à des propositions d’organisations non gouvernementales (ONG) et d’associations de développement oeuvrant au Niger. Les initiatives ainsi appuyées ont contribué au renforcement des capacités institutionnelles des organisations partenaires et à un meilleur accès à des services sociaux ainsi qu'à une meilleure alimentation de base pour les populations les plus démunies\, principalement les femmes et les enfants. Le FALP II concentre ses appuis dans les régions de Maradi\, Tillabéri et Tahoua.","en,fr","CA,CA-1,","10,10,10","1,3,4",,",,11000","Canada,Canada,Canadian International Development Agency,Agence canadienne de développement international,Embassy of Canada to Niger,Ambassade du Canada au Niger","en,fr,en,fr,en,fr",2007000795,A2,,,,4,"2,3,4","2007-06-20T00:00:00Z,2012-03-30T00:00:00Z,2012-03-30T00:00:00Z",,,1,"Foreign Affairs\, Trade and Development Canada (DFATD),Affaires étrangères\, Commerce et Développement Canada (MAECD)","en,fr",,,,,,,,info@international.gc.ca,www.international.gc.ca,"125 Sussex Drive\, Ottawa\, Ontario\, K1A 0G2,125\, promenade Sussex\, Ottawa (Ontario)\, K1A 0G2","en,fr",5,NE,100.0,,,,,,,,,,1,2440485,G1,,,,,,,,,,http://www.opengis.net/def/crs/EPSG/0/4326,13.51366 2.1098,2,1,,"1,1,1,1,1",,"11220,12220,14031,14032,15150","25.0,25.0,12.5,12.5,25.0",,,,,,,,,,,,,,,,,,,"1,1,1,1,1,1,1,99,1,99,99,1,99,99",",,,,,,,https://www.international.gc.ca/department-ministere/open_data-donnees_ouvertes/dev/data_field_definitions-definitions_champs_donnees.aspx?lang=eng#a2,,https://www.international.gc.ca/department-ministere/open_data-donnees_ouvertes/dev/data_field_definitions-definitions_champs_donnees.aspx?lang=eng#a2,https://www.international.gc.ca/department-ministere/open_data-donnees_ouvertes/dev/data_field_definitions-definitions_champs_donnees.aspx?lang=eng#a2,,https://www.international.gc.ca/department-ministere/open_data-donnees_ouvertes/dev/data_field_definitions-definitions_champs_donnees.aspx?lang=eng#a2,https://www.international.gc.ca/department-ministere/open_data-donnees_ouvertes/dev/data_field_definitions-definitions_champs_donnees.aspx?lang=eng#a2","1,2,3,4,5,6,7,8,8,9,10,11,11,13","1,0,0,0,0,0,0,0,0,1,1,0,0,0","Urban issues,Questions urbaines,Children's issues,Questions touchant les enfants,Adolescent (Youth) Issues,Questions touchant les adolescents (jeunes),Indigenous issues,Questions touchant les populations autochtones,ICT as a tool for development,Les TIC comme outils de développement","en,fr,en,fr,en,fr,en,fr,en,fr",1,,110,C01,,,,,,,,,,,,,,,,,,,,,,2,2007-06-20T00:00:00Z,3258531.52,,2007-06-20T00:00:00Z,,,,,,,,,,,,,,,,,,,,,,,,,,,10,,,,5,"http://w05.international.gc.ca/projectbrowser-banqueprojets/project-projet/details/A033236001?Lang=eng,https://search.open.canada.ca/en/gc/?sort=score%20desc&page=1&search_text=A033236001,http://w05.international.gc.ca/projectbrowser-banqueprojets/project-projet/details/A033236001?Lang=fra,https://rechercher.ouvert.canada.ca/fr/gc/?sort=score desc&page=1&search_text=A033236001","text/html,text/html,text/html,text/html","Description,Proactive disclosure,Description,Divulgation proactive","en,fr,fr,fr",,,"A02,A08,A06,A02,A08,A06","en,en,fr,fr",,,,,,,false,,,,2,,"Results achieved,Résultats atteints","en,fr",,,,,,,,,,,,,,,5,,,"Results achieved,Résultats atteints","en,fr","Results achieved by this project as of March 2011 include: 1\,041 women in four communes of the Tahoua region have access to self-managed microcredit to carry out revenue-generating activities. 540 producers in the Maradi region\, including 150 women\, were trained at 27 field schools and have built their capacities in agricultural techniques. The members of 52 farmers’ organizations better understand their role and are actively involved in associations in their region. An integrated health centre has been established in Maradi and it provides quality health care to an estimated population of 10\,811. In the Tahoua region\, 7\,589 people have greater access to safe drinking water\, thanks to the building of three modern wells in Cheghamane\, Intoussa\, and Goumbi Danyayé\, as well as the rehabilitation of two wells in Fallali and Maraba Kao.,Parmi les résultats obtenus par le projet jusqu'en mars 2011 : 1 041 femmes de quatre communes de la région de Tahoua ont accès au micro-crédit autogéré pour mener des activités génératrices de revenus; 540 producteurs\, dont 150 femmes\, de la région de Maradi ont été formés dans 27 écoles sur le terrain et ont renforcé leurs compétences en techniques agricoles et les membres de 52 organisations paysannes connaissent mieux leur rôle et participent activement dans la vie associative de leur région. Un centre de santé intégré a été mis en place à Maradi et dispense des soins de santé de qualité à une population estimée à 10 811 personnes. Dans la région de Tahoua\, 7 589 personnes ont un accès accru à l’eau potable grâce à la construction de trois puits modernes à Cheghamane\, Intoussa et Goumbi Danyayé et à la réhabilitation de deux puits à Fallali et Maraba Kao.","en,fr",,,,,,,,,,,,,,,,,,,,,,,,,,,,,,,,,,,,,,,,,,,,,,,,,,,,,,,,,,,,,,,,,,,,,,,,,,,,,,,,,,,,,
2.03,2021-04-26T00:00:00Z,,2021-04-26T00:00:00Z,en,CHF,,,,,CH-4-2012006304,CH-4,10,,Swiss Agency for Development and Cooperation (SDC),,Programme d’Hydraulique Rurale – Appui Au Secteur Eau et Assainissement (PHRASEA) Phase 2,,1,"Moins de 50% des nigériens ont accès à l’eau potable et seuls 7% disposent de conditions d'assainissement de base. La croissance démographique galopante\, la dispersion de la population sur le territoire et la précarité des finances publiques sont des contraintes empêchant l'accès des populations à ces services de base. Le PHRASEA vient en appui aux efforts du gouvernement\, en misant sur la maitrise d’ouvrage des communes.",,"CH-4,XM-DAC-12002","10,10","1,4",,,"Swiss Agency for Development and Cooperation (SDC),Gouvernement local (SUD/EST)",,7F-07792.02.02,A1,,,,2,"1,2,3","2017-01-01T00:00:00Z,2017-01-01T00:00:00Z,2021-12-31T00:00:00Z",,,1,Swiss Agency for Development and Cooperation SDC,,Statistics Unit,,,,,,+41 58 464 92 35,stats.sdc@eda.admin.ch,http://www.sdc.admin.ch,"Freiburgstrasse 130\, 3003 Berne",,,NE,,Niger,,,,,,,,,,,,,,,,,,,,,,,,,,"1,1,1",,"14031,31140,15112","20.0,30.0,50.0",,,,,,,,,,,,,,,,,,,,,"6,8,7,2,5,9,1","0,2,0,2,0,0,1","Aid Targeting the Objectives of the Framework Convention on Climate Change - Mitigation,Aid Targeting the Objectives of the Convention to Combat Desertification,Aid Targeting the Objectives of the Framework Convention on Climate Change - Adaptation,Aid to Environment,Aid Targeting the Objectives of the Convention on Biological Diversity,Reproductive\, Maternal\, Newborn and Child Health (RMNCH),Gender Equality",,1,10,110,C01,1,5,,,,,,,,,,,,,,,,,,7F-07792.02.02,,2,2020-12-31T00:00:00Z,0.0,CHF,2020-12-31T00:00:00Z,Outgoing Commitment,,,,,,,,,,,,,,,,,,,,,,,,,,,,,,,,,,,,,,,,,,,,,false,,,,,,,,,,,,,,,,,,,,,,,,,,,,,,,,,,,,,,,,,,,,,,,,,,,,,,,,,,,,,,,,,,,,,,,,,,,,,,,,,,,,,,,,,,,,,,,,,,,,,,,,,,,,,,,,,
2.03,2021-04-26T00:00:00Z,,2021-04-26T00:00:00Z,en,CHF,,,,,CH-4-2012006304,CH-4,10,,Swiss Agency for Development and Cooperation (SDC),,Programme d’Hydraulique Rurale – Appui Au Secteur Eau et Assainissement (PHRASEA) Phase 2,,1,"Moins de 50% des nigériens ont accès à l’eau potable et seuls 7% disposent de conditions d'assainissement de base. La croissance démographique galopante\, la dispersion de la population sur le territoire et la précarité des finances publiques sont des contraintes empêchant l'accès des populations à ces services de base. Le PHRASEA vient en appui aux efforts du gouvernement\, en misant sur la maitrise d’ouvrage des communes.",,"CH-4,XM-DAC-12002","10,10","1,4",,,"Swiss Agency for Development and Cooperation (SDC),Gouvernement local (SUD/EST)",,7F-07792.02.02,A1,,,,2,"1,2,3","2017-01-01T00:00:00Z,2017-01-01T00:00:00Z,2021-12-31T00:00:00Z",,,1,Swiss Agency for Development and Cooperation SDC,,Statistics Unit,,,,,,+41 58 464 92 35,stats.sdc@eda.admin.ch,http://www.sdc.admin.ch,"Freiburgstrasse 130\, 3003 Berne",,,NE,,Niger,,,,,,,,,,,,,,,,,,,,,,,,,,"1,1,1",,"14031,31140,15112","20.0,30.0,50.0",,,,,,,,,,,,,,,,,,,,,"6,8,7,2,5,9,1","0,2,0,2,0,0,1","Aid Targeting the Objectives of the Framework Convention on Climate Change - Mitigation,Aid Targeting the Objectives of the Convention to Combat Desertification,Aid Targeting the Objectives of the Framework Convention on Climate Change - Adaptation,Aid to Environment,Aid Targeting the Objectives of the Convention on Biological Diversity,Reproductive\, Maternal\, Newborn and Child Health (RMNCH),Gender Equality",,1,10,110,C01,1,5,,,,,,,,,,,,,,,,,,7F-07792.02.02,,3,2020-12-31T00:00:00Z,1000000.0,CHF,2020-12-31T00:00:00Z,Disbursement,,,,,,,,,,,,,,,,,,,,,,,,,,,,,,,,,,,,,,,,,,,,,false,,,,,,,,,,,,,,,,,,,,,,,,,,,,,,,,,,,,,,,,,,,,,,,,,,,,,,,,,,,,,,,,,,,,,,,,,,,,,,,,,,,,,,,,,,,,,,,,,,,,,,,,,,,,,,,,,
2.03,2020-03-04T00:00:00Z,,2020-03-04T00:00:00Z,en,CHF,,,,,CH-4-2012006304,CH-4,10,,Swiss Agency for Development and Cooperation (SDC),,Programme d’Hydraulique Rurale – Appui Au Secteur Eau et Assainissement (PHRASEA) Phase 2,,1,"Moins de 50% des nigériens ont accès à l’eau potable et seuls 7% disposent de conditions d'assainissement de base. La croissance démographique galopante\, la dispersion de la population sur le territoire et la précarité des finances publiques sont des contraintes empêchant l'accès des populations à ces services de base. Le PHRASEA vient en appui aux efforts du gouvernement\, en misant sur la maitrise d’ouvrage des communes.",,"CH-4,XM-DAC-12002","10,10","1,4",,,"Swiss Agency for Development and Cooperation (SDC),Gouvernement local (SUD/EST)",,7F-07792.02.02,A1,,,,2,"1,2,3,4","2017-01-01T00:00:00Z,2017-01-01T00:00:00Z,2021-12-31T00:00:00Z,2021-12-31T00:00:00Z",,,1,Swiss Agency for Development and Cooperation SDC,,Statistics Unit,,,,,,+41 58 464 92 35,stats.sdc@eda.admin.ch,http://www.sdc.admin.ch,"Freiburgstrasse 130\, 3003 Berne",,,NE,,Niger,,,,,,,,,,,,,,,,,,,,,,,,,,"1,1,1",,"14031,31140,15112","20.0,30.0,50.0",,,,,,,,,,,,,,,,,,,,,"6,8,7,2,5,9,1","0,2,0,2,0,0,1","Aid Targeting the Objectives of the Framework Convention on Climate Change - Mitigation,Aid Targeting the Objectives of the Convention to Combat Desertification,Aid Targeting the Objectives of the Framework Convention on Climate Change - Adaptation,Aid to Environment,Aid Targeting the Objectives of the Convention on Biological Diversity,Reproductive\, Maternal\, Newborn and Child Health (RMNCH),Gender Equality",,1,10,110,C01,1,5,,,,,,,,,,,,,,,,,,7F-07792.02.02,,2,2019-12-15T00:00:00Z,0.0,CHF,2019-12-15T00:00:00Z,Outgoing Commitment,,,,,,,,,,,,,,,,,,,,,,,,,,,,,,,,,,,,,,,,,,,,,false,,,,,,,,,,,,,,,,,,,,,,,,,,,,,,,,,,,,,,,,,,,,,,,,,,,,,,,,,,,,,,,,,,,,,,,,,,,,,,,,,,,,,,,,,,,,,,,,,,,,,,,,,,,,,,,,,
2.03,2020-03-04T00:00:00Z,,2020-03-04T00:00:00Z,en,CHF,,,,,CH-4-2012006304,CH-4,10,,Swiss Agency for Development and Cooperation (SDC),,Programme d’Hydraulique Rurale – Appui Au Secteur Eau et Assainissement (PHRASEA) Phase 2,,1,"Moins de 50% des nigériens ont accès à l’eau potable et seuls 7% disposent de conditions d'assainissement de base. La croissance démographique galopante\, la dispersion de la population sur le territoire et la précarité des finances publiques sont des contraintes empêchant l'accès des populations à ces services de base. Le PHRASEA vient en appui aux efforts du gouvernement\, en misant sur la maitrise d’ouvrage des communes.",,"CH-4,XM-DAC-12002","10,10","1,4",,,"Swiss Agency for Development and Cooperation (SDC),Gouvernement local (SUD/EST)",,7F-07792.02.02,A1,,,,2,"1,2,3,4","2017-01-01T00:00:00Z,2017-01-01T00:00:00Z,2021-12-31T00:00:00Z,2021-12-31T00:00:00Z",,,1,Swiss Agency for Development and Cooperation SDC,,Statistics Unit,,,,,,+41 58 464 92 35,stats.sdc@eda.admin.ch,http://www.sdc.admin.ch,"Freiburgstrasse 130\, 3003 Berne",,,NE,,Niger,,,,,,,,,,,,,,,,,,,,,,,,,,"1,1,1",,"14031,31140,15112","20.0,30.0,50.0",,,,,,,,,,,,,,,,,,,,,"6,8,7,2,5,9,1","0,2,0,2,0,0,1","Aid Targeting the Objectives of the Framework Convention on Climate Change - Mitigation,Aid Targeting the Objectives of the Convention to Combat Desertification,Aid Targeting the Objectives of the Framework Convention on Climate Change - Adaptation,Aid to Environment,Aid Targeting the Objectives of the Convention on Biological Diversity,Reproductive\, Maternal\, Newborn and Child Health (RMNCH),Gender Equality",,1,10,110,C01,1,5,,,,,,,,,,,,,,,,,,7F-07792.02.02,,3,2019-12-15T00:00:00Z,1619048.0,CHF,2019-12-15T00:00:00Z,Disbursement,,,,,,,,,,,,,,,,,,,,,,,,,,,,,,,,,,,,,,,,,,,,,false,,,,,,,,,,,,,,,,,,,,,,,,,,,,,,,,,,,,,,,,,,,,,,,,,,,,,,,,,,,,,,,,,,,,,,,,,,,,,,,,,,,,,,,,,,,,,,,,,,,,,,,,,,,,,,,,,
2.03,2019-03-11T00:00:00Z,,2019-03-11T00:00:00Z,en,CHF,,,,,CH-4-2012006304,CH-4,10,,Swiss Agency for Development and Cooperation (SDC),,Programme d’Hydraulique Rurale – Appui Au Secteur Eau et Assainissement (PHRASEA) Phase 2,,1,"Moins de 50% des nigériens ont accès à l’eau potable et seuls 7% disposent de conditions d'assainissement de base. La croissance démographique galopante\, la dispersion de la population sur le territoire et la précarité des finances publiques sont des contraintes empêchant l'accès des populations à ces services de base. Le PHRASEA vient en appui aux efforts du gouvernement\, en misant sur la maitrise d’ouvrage des communes.",,"CH-4,XM-DAC-12002","10,10","1,4",,,"Swiss Agency for Development and Cooperation (SDC),Gouvernement local (SUD/EST)",,7F-07792.02.02,A1,,,,2,"1,2,3,4","2017-01-01T00:00:00Z,2017-01-01T00:00:00Z,2021-12-31T00:00:00Z,2021-12-31T00:00:00Z",,,1,Swiss Agency for Development and Cooperation SDC,,Statistics Unit,,,,,,+41 58 464 92 35,stats.sdc@eda.admin.ch,http://www.sdc.admin.ch,"Freiburgstrasse 130\, 3003 Berne",,,NE,,Niger,,,,,,,,,,,,,,,,,,,,,,,,,,"1,1,1",,"14031,31140,15112","20.0,30.0,50.0",,,,,,,,,,,,,,,,,,,,,"6,8,7,2,5,9","0,2,0,1,0,0","Aid Targeting the Objectives of the Framework Convention on Climate Change - Mitigation,Aid Targeting the Objectives of the Convention to Combat Desertification,Aid Targeting the Objectives of the Framework Convention on Climate Change - Adaptation,Aid to Environment,Aid Targeting the Objectives of the Convention on Biological Diversity,Reproductive\, Maternal\, Newborn and Child Health (RMNCH)",,1,10,110,C01,1,5,,,,,,,,,,,,,,,,,,7F-07792.02.02,,3,2018-12-15T00:00:00Z,2095069.0,CHF,2018-12-15T00:00:00Z,Disbursement,,,,,,,,,,,,,,,,,,,,,,,,,,,,,,,,,,,,,,,,,,,,,false,,,,,,,,,,,,,,,,,,,,,,,,,,,,,,,,,,,,,,,,,,,,,,,,,,,,,,,,,,,,,,,,,,,,,,,,,,,,,,,,,,,,,,,,,,,,,,,,,,,,,,,,,,,,,,,,,
